{
  "artifacts": [
    {
      "path": "dist/projections/ecocheck/ontology-contracts.generated.json",
      "sha256": "11b6d9e6becbdd45540bc998b6c74270ab9a678377b1ecd92b4c9aa81082f457"
    },
    {
      "path": "dist/projections/graph/ontology-registry.generated.json",
      "sha256": "18846a7375b54b034c8512a5e71de6222fd8db086b2b031594ba87b0ad173479"
    },
    {
      "path": "dist/projections/graph/schema.fragment.generated.json",
      "sha256": "f2720412066da1d80ff3eeadcdb070863338f7053a01a23719b3fa714bb81ea6"
    },
    {
      "path": "dist/projections/kb/ontology-registry.generated.json",
      "sha256": "77312a8f0602092cae83d175d2fe91e388ab86721455bb37a543868f56c9878a"
    },
    {
      "path": "dist/projections/kb/schema.fragment.generated.json",
      "sha256": "99ac8d0ce129b0f06cd2c5189d30da500389a16ce5889746273df7e48550a5bc"
    }
  ],
  "generated_by": {
    "generator": "scripts/generate-projections.mjs",
    "generator_version": "1",
    "ontology_version": "0.1.0",
    "source_sha256": {
      "registries/entity_anchors.v1.json": "d3c81a1ef9217514cb938f3eb6b6caf05abce1eaf9ef24c3b2a476c3b1975d3d",
      "registries/issue_types.v1.json": "4603c6abfd2c29f5eae970ec039ec532174ce6ffae85d65a84c86810754654d1",
      "registries/legal_basis_ref.v1.json": "3ba958736be66b9d9ed917dbf9144d22efccc63bcf90b5887c80e39f0e699457",
      "registries/observed_signals.v1.json": "86fc1aa045c758df44d1675ff6f2a3e4d72040d94d57fd8454cd5c1b8b59590d",
      "registries/risk_domains.v1.json": "766485ce94a36290d8a46800c700fa42b6383f503e175b06b0f1a1cc6e78bb0c",
      "schemas/kb_product_manifest.v1.schema.json": "d13cabd36eb1c7a1c47f96b52e68f6992fcf214a346e4a36872e83de7a5218b3",
      "schemas/ontology_registry.v1.schema.json": "c0a97784d8f51243468e40f4268caa0f308bcf77e1491aded54a517044c0aba2",
      "schemas/profile_gap_confirmed.v1.schema.json": "1a1a3901fb22b8121d7b88b3c9d75633598275a2559b62c77146bae1d756f383",
      "schemas/semantic_event.v2.schema.json": "d4d0bda9d608baa69970df1260446f00c9e26884c7d773d77a5ec847f5e4f737"
    }
  },
  "ontology_version": "0.1.0",
  "schema_version": "eco-ontology.projection_manifest.v1"
}
